### ISSUE TITLE
`--fake` doesn't work on OpenWrt 19.07.10 (mips_24kc)

### ISSUE THREAD

**Issue by Trigger239** [hufrea/byedpi#347]
# The problem

I've tried to run ByeDPI v0.17.3 on my OpenWrt router, and it seems like the `--fake` option doesn't work correctly. It's very unfortunate because it is the only option that allows me to access websites behind CDNs (Cloudflare, Hetzner, DigitalOcean, etc).

# Detailed description

ByeDPI is started on the router like this:

```
ciadpi-mips -x2 -i 192.168.239.1 -T1.5 -f-1 -nweb.max.ru -t7
```

An Android phone is connected to the Wi-Fi. The Tun2Socks app is used to connect to the SOCKS proxy at `192.168.239.1:1080` (`192.168.239.1` is the routers's IP). When I try to open `https://fontanka.ru` (`195.19.220.21:443`) in a web browser (this website is definitely not blocked by DPI), I get the following packets on the `eth2` interface (this is an upstream connection - LTE USB modem (NCM)):

```
tcpdump -i eth2 "host 195.19.220.21" -v -c20 -x -s256 > /tmp/dump-mips.txt
```

<details>
<summary>/tmp/dump-mips.txt</summary>

```
19:39:04.783791 IP (tos 0x0, ttl 64, id 20558, offset 0, flags [DF], proto TCP (6), length 60)
    10.120.26.36.56487 > 195.19.220.21.443: Flags [S], cksum 0x81fe (correct), seq 510997533, win 29200, options [mss 1460,sackOK,TS val 1040523574 ecr 0,nop,wscale 3], length 0
	0x0000:  4500 003c 504e 4000 4006 26a9 0a78 1a24
	0x0010:  c313 dc15 dca7 01bb 1e75 341d 0000 0000
	0x0020:  a002 7210 81fe 0000 0204 05b4 0402 080a
	0x0030:  3e05 2136 0000 0000 0103 0303
19:39:04.908176 IP (tos 0x28, ttl 51, id 0, offset 0, flags [DF], proto TCP (6), length 60)
    195.19.220.21.443 > 10.120.26.36.56487: Flags [S.], cksum 0x54c7 (correct), seq 1806432501, ack 510997534, win 31856, options [mss 1360,sackOK,TS val 1560502657 ecr 1040523574,nop,wscale 7], length 0
	0x0000:  4528 003c 0000 4000 3306 83cf c313 dc15
	0x0010:  0a78 1a24 01bb dca7 6bab f8f5 1e75 341e
	0x0020:  a012 7c70 54c7 0000 0204 0550 0402 080a
	0x0030:  5d03 6181 3e05 2136 0103 0307
19:39:04.908453 IP (tos 0x0, ttl 64, id 20559, offset 0, flags [DF], proto TCP (6), length 52)
    10.120.26.36.56487 > 195.19.220.21.443: Flags [.], cksum 0xf0e0 (correct), ack 1, win 3650, options [nop,nop,TS val 1040523699 ecr 1560502657], length 0
	0x0000:  4500 0034 504f 4000 4006 26b0 0a78 1a24
	0x0010:  c313 dc15 dca7 01bb 1e75 341e 6bab f8f6
	0x0020:  8010 0e42 f0e0 0000 0101 080a 3e05 21b3
	0x0030:  5d03 6181
19:39:04.927116 IP (tos 0x0, ttl 7, id 20560, offset 0, flags [DF], proto TCP (6), length 1400)
    10.120.26.36.56487 > 195.19.220.21.443: Flags [.], seq 1:1349, ack 1, win 3650, options [nop,nop,TS val 1040523718 ecr 1560502657], length 1348
	0x0000:  4500 0578 5050 4000 0706 5a6b 0a78 1a24
	0x0010:  c313 dc15 dca7 01bb 1e75 341e 6bab f8f6
	0x0020:  8010 0e42 6f77 0000 0101 080a 3e05 21c6
	0x0030:  5d03 6181 1603 0106 b801 0006 b403 0303
	0x0040:  5f6f 2ced 1322 f8dc b2f2 6048 2d72 666f
	0x0050:  57dd 139d 1b37 dcfa 362e baf9 9299 3a20
	0x0060:  f9df 0c2e 8a55 8982 3163 1aef a8be 0858
	0x0070:  a7a3 5a18 d396 5f04 5cb4 62af 89d7 0f8b
	0x0080:  003e 1302 1303 1301 c02c c030 009f cca9
	0x0090:  cca8 ccaa c02b c02f 009e c024 c028 006b
	0x00a0:  c023 c027 0067 c00a c014 0039 c009 c013
	0x00b0:  0033 009d 009c 003d 003c 0035 002f 00ff
	0x00c0:  0100 062d 0000 000f 000d 0000 0a77 6562
	0x00d0:  2e6d 6178 2e72 7500 0b00 0403 0001 0200
	0x00e0:  0a00 1600 1400 1d00 1700 1e00 1900 1801
	0x00f0:  0001
19:39:04.927249 IP (tos 0x0, ttl 7, id 20561, offset 0, flags [DF], proto TCP (6), length 428)
    10.120.26.36.56487 > 195.19.220.21.443: Flags [P.], seq 1349:1725, ack 1, win 3650, options [nop,nop,TS val 1040523718 ecr 1560502657], length 376
	0x0000:  4500 01ac 5051 4000 0706 5e36 0a78 1a24
	0x0010:  c313 dc15 dca7 01bb 1e75 3962 6bab f8f6
	0x0020:  8018 0e42 ea09 0000 0101 080a 3e05 21c6
	0x0030:  5d03 6181 0000 0000 0000 0000 0000 0000
	0x0040:  0000 0000 0000 0000 0000 0000 0000 0000
	0x0050:  0000 0000 0000 0000 0000 0000 0000 0000
	0x0060:  0000 0000 0000 0000 0000 0000 0000 0000
	0x0070:  0000 0000 0000 0000 0000 0000 0000 0000
	0x0080:  0000 0000 0000 0000 0000 0000 0000 0000
	0x0090:  0000 0000 0000 0000 0000 0000 0000 0000
	0x00a0:  0000 0000 0000 0000 0000 0000 0000 0000
	0x00b0:  0000 0000 0000 0000 0000 0000 0000 0000
	0x00c0:  0000 0000 0000 0000 0000 0000 0000 0000
	0x00d0:  0000 0000 0000 0000 0000 0000 0000 0000
	0x00e0:  0000 0000 0000 0000 0000 0000 0000 0000
	0x00f0:  0000
19:39:04.929072 IP (tos 0x0, ttl 64, id 20562, offset 0, flags [DF], proto TCP (6), length 53)
    10.120.26.36.56487 > 195.19.220.21.443: Flags [P.], cksum 0xea06 (correct), seq 1725:1726, ack 1, win 3650, options [nop,nop,TS val 1040523720 ecr 1560502657], length 1
	0x0000:  4500 0035 5052 4000 4006 26ac 0a78 1a24
	0x0010:  c313 dc15 dca7 01bb 1e75 3ada 6bab f8f6
	0x0020:  8018 0e42 ea06 0000 0101 080a 3e05 21c8
	0x0030:  5d03 6181 00
19:39:04.969173 IP (tos 0x28, ttl 51, id 31915, offset 0, flags [DF], proto TCP (6), length 64)
    195.19.220.21.443 > 10.120.26.36.56487: Flags [.], cksum 0x1535 (correct), ack 1, win 249, options [nop,nop,TS val 1560502719 ecr 1040523699,nop,nop,sack 1 {1725:1726}], length 0
	0x0000:  4528 0040 7cab 4000 3306 0720 c313 dc15
	0x0010:  0a78 1a24 01bb dca7 6bab f8f6 1e75 341e
	0x0020:  b010 00f9 1535 0000 0101 080a 5d03 61bf
	0x0030:  3e05 21b3 0101 050a 1e75 3ada 1e75 3adb
19:39:05.002710 IP (tos 0x0, ttl 64, id 20563, offset 0, flags [DF], proto TCP (6), length 1400)
    10.120.26.36.56487 > 195.19.220.21.443: Flags [.], seq 1:1349, ack 1, win 3650, options [nop,nop,TS val 1040523793 ecr 1560502719], length 1348
	0x0000:  4500 0578 5053 4000 4006 2168 0a78 1a24
	0x0010:  c313 dc15 dca7 01bb 1e75 341e 6bab f8f6
	0x0020:  8010 0e42 6eee 0000 0101 080a 3e05 2211
	0x0030:  5d03 61bf 1603 0106 b801 0006 b403 0303
	0x0040:  5f6f 2ced 1322 f8dc b2f2 6048 2d72 666f
	0x0050:  57dd 139d 1b37 dcfa 362e baf9 9299 3a20
	0x0060:  f9df 0c2e 8a55 8982 3163 1aef a8be 0858
	0x0070:  a7a3 5a18 d396 5f04 5cb4 62af 89d7 0f8b
	0x0080:  003e 1302 1303 1301 c02c c030 009f cca9
	0x0090:  cca8 ccaa c02b c02f 009e c024 c028 006b
	0x00a0:  c023 c027 0067 c00a c014 0039 c009 c013
	0x00b0:  0033 009d 009c 003d 003c 0035 002f 00ff
	0x00c0:  0100 062d 0000 000f 000d 0000 0a77 6562
	0x00d0:  2e6d 6178 2e72 7500 0b00 0403 0001 0200
	0x00e0:  0a00 1600 1400 1d00 1700 1e00 1900 1801
	0x00f0:  0001
19:39:05.044165 IP (tos 0x28, ttl 51, id 31916, offset 0, flags [DF], proto TCP (6), length 64)
    195.19.220.21.443 > 10.120.26.36.56487: Flags [.], cksum 0x0f4a (correct), ack 1349, win 249, options [nop,nop,TS val 1560502792 ecr 1040523793,nop,nop,sack 1 {1725:1726}], length 0
	0x0000:  4528 0040 7cac 4000 3306 071f c313 dc15
	0x0010:  0a78 1a24 01bb dca7 6bab f8f6 1e75 3962
	0x0020:  b010 00f9 0f4a 0000 0101 080a 5d03 6208
	0x0030:  3e05 2211 0101 050a 1e75 3ada 1e75 3adb
19:39:05.044392 IP (tos 0x0, ttl 64, id 20564, offset 0, flags [DF], proto TCP (6), length 428)
    10.120.26.36.56487 > 195.19.220.21.443: Flags [P.], seq 1349:1725, ack 1, win 3650, options [nop,nop,TS val 1040523835 ecr 1560502792], length 376
	0x0000:  4500 01ac 5054 4000 4006 2533 0a78 1a24
	0x0010:  c313 dc15 dca7 01bb 1e75 3962 6bab f8f6
	0x0020:  8018 0e42 e90d 0000 0101 080a 3e05 223b
	0x0030:  5d03 6208 0000 0000 0000 0000 0000 0000
	0x0040:  0000 0000 0000 0000 0000 0000 0000 0000
	0x0050:  0000 0000 0000 0000 0000 0000 0000 0000
	0x0060:  0000 0000 0000 0000 0000 0000 0000 0000
	0x0070:  0000 0000 0000 0000 0000 0000 0000 0000
	0x0080:  0000 0000 0000 0000 0000 0000 0000 0000
	0x0090:  0000 0000 0000 0000 0000 0000 0000 0000
	0x00a0:  0000 0000 0000 0000 0000 0000 0000 0000
	0x00b0:  0000 0000 0000 0000 0000 0000 0000 0000
	0x00c0:  0000 0000 0000 0000 0000 0000 0000 0000
	0x00d0:  0000 0000 0000 0000 0000 0000 0000 0000
	0x00e0:  0000 0000 0000 0000 0000 0000 0000 0000
	0x00f0:  0000
19:39:05.074124 IP (tos 0x28, ttl 51, id 31917, offset 0, flags [DF], proto TCP (6), length 52)
    195.19.220.21.443 > 10.120.26.36.56487: Flags [.], cksum 0xf63d (correct), ack 1726, win 249, options [nop,nop,TS val 1560502824 ecr 1040523835], length 0
	0x0000:  4528 0034 7cad 4000 3306 072a c313 dc15
	0x0010:  0a78 1a24 01bb dca7 6bab f8f6 1e75 3adb
	0x0020:  8010 00f9 f63d 0000 0101 080a 5d03 6228
	0x0030:  3e05 223b
19:39:05.074244 IP (tos 0x28, ttl 51, id 31918, offset 0, flags [DF], proto TCP (6), length 59)
    195.19.220.21.443 > 10.120.26.36.56487: Flags [P.], cksum 0xad29 (correct), seq 1:8, ack 1726, win 249, options [nop,nop,TS val 1560502824 ecr 1040523835], length 7
	0x0000:  4528 003b 7cae 4000 3306 0722 c313 dc15
	0x0010:  0a78 1a24 01bb dca7 6bab f8f6 1e75 3adb
	0x0020:  8018 00f9 ad29 0000 0101 080a 5d03 6228
	0x0030:  3e05 223b 1503 0300 0202 2f
19:39:05.074344 IP (tos 0x0, ttl 64, id 20565, offset 0, flags [DF], proto TCP (6), length 52)
    10.120.26.36.56487 > 195.19.220.21.443: Flags [.], cksum 0xe8cf (correct), ack 8, win 3650, options [nop,nop,TS val 1040523865 ecr 1560502824], length 0
	0x0000:  4500 0034 5055 4000 4006 26aa 0a78 1a24
	0x0010:  c313 dc15 dca7 01bb 1e75 3adb 6bab f8fd
	0x0020:  8010 0e42 e8cf 0000 0101 080a 3e05 2259
	0x0030:  5d03 6228
19:39:05.077122 IP (tos 0x28, ttl 51, id 31919, offset 0, flags [DF], proto TCP (6), length 52)
    195.19.220.21.443 > 10.120.26.36.56487: Flags [F.], cksum 0xf635 (correct), seq 8, ack 1726, win 249, options [nop,nop,TS val 1560502824 ecr 1040523835], length 0
	0x0000:  4528 0034 7caf 4000 3306 0728 c313 dc15
	0x0010:  0a78 1a24 01bb dca7 6bab f8fd 1e75 3adb
	0x0020:  8011 00f9 f635 0000 0101 080a 5d03 6228
	0x0030:  3e05 223b
19:39:05.077576 IP (tos 0x0, ttl 64, id 20566, offset 0, flags [DF], proto TCP (6), length 52)
    10.120.26.36.56487 > 195.19.220.21.443: Flags [F.], cksum 0xe8ca (correct), seq 1726, ack 9, win 3650, options [nop,nop,TS val 1040523868 ecr 1560502824], length 0
	0x0000:  4500 0034 5056 4000 4006 26a9 0a78 1a24
	0x0010:  c313 dc15 dca7 01bb 1e75 3adb 6bab f8fe
	0x0020:  8011 0e42 e8ca 0000 0101 080a 3e05 225c
	0x0030:  5d03 6228
19:39:05.102170 IP (tos 0x28, ttl 51, id 31920, offset 0, flags [DF], proto TCP (6), length 52)
    195.19.220.21.443 > 10.120.26.36.56487: Flags [.], cksum 0xf5f8 (correct), ack 1727, win 249, options [nop,nop,TS val 1560502851 ecr 1040523868], length 0
	0x0000:  4528 0034 7cb0 4000 3306 0727 c313 dc15
	0x0010:  0a78 1a24 01bb dca7 6bab f8fe 1e75 3adc
	0x0020:  8010 00f9 f5f8 0000 0101 080a 5d03 6243
	0x0030:  3e05 225c
19:39:05.188125 IP (tos 0x0, ttl 64, id 1758, offset 0, flags [DF], proto TCP (6), length 60)
    10.120.26.36.38157 > 195.19.220.21.443: Flags [S], cksum 0x409d (correct), seq 963223695, win 29200, options [mss 1460,sackOK,TS val 1040523979 ecr 0,nop,wscale 3], length 0
	0x0000:  4500 003c 06de 4000 4006 7019 0a78 1a24
	0x0010:  c313 dc15 950d 01bb 3969 a08f 0000 0000
	0x0020:  a002 7210 409d 0000 0204 05b4 0402 080a
	0x0030:  3e05 22cb 0000 0000 0103 0303
19:39:05.218162 IP (tos 0x28, ttl 51, id 0, offset 0, flags [DF], proto TCP (6), length 60)
    195.19.220.21.443 > 10.120.26.36.38157: Flags [S.], cksum 0xb7d8 (correct), seq 1457591640, ack 963223696, win 31856, options [mss 1360,sackOK,TS val 717612980 ecr 1040523979,nop,wscale 7], length 0
	0x0000:  4528 003c 0000 4000 3306 83cf c313 dc15
	0x0010:  0a78 1a24 01bb 950d 56e1 1558 3969 a090
	0x0020:  a012 7c70 b7d8 0000 0204 0550 0402 080a
	0x0030:  2ac5 e7b4 3e05 22cb 0103 0307
19:39:05.218439 IP (tos 0x0, ttl 64, id 1759, offset 0, flags [DF], proto TCP (6), length 52)
    10.120.26.36.38157 > 195.19.220.21.443: Flags [.], cksum 0x5451 (correct), ack 1, win 3650, options [nop,nop,TS val 1040524009 ecr 717612980], length 0
	0x0000:  4500 0034 06df 4000 4006 7020 0a78 1a24
	0x0010:  c313 dc15 950d 01bb 3969 a090 56e1 1559
	0x0020:  8010 0e42 5451 0000 0101 080a 3e05 22e9
	0x0030:  2ac5 e7b4
19:39:05.225884 IP (tos 0x0, ttl 7, id 1760, offset 0, flags [DF], proto TCP (6), length 1400)
    10.120.26.36.38157 > 195.19.220.21.443: Flags [.], seq 1:1349, ack 1, win 3650, options [nop,nop,TS val 1040524017 ecr 717612980], length 1348
	0x0000:  4500 0578 06e0 4000 0706 a3db 0a78 1a24
	0x0010:  c313 dc15 950d 01bb 3969 a090 56e1 1559
	0x0020:  8010 0e42 5272 0000 0101 080a 3e05 22f1
	0x0030:  2ac5 e7b4 1603 0106 f801 0006 f403 0303
	0x0040:  5f6f 2ced 1322 f8dc b2f2 6048 2d72 666f
	0x0050:  57dd 139d 1b37 dcfa 362e baf9 9299 3a20
	0x0060:  f9df 0c2e 8a55 8982 3163 1aef a8be 0858
	0x0070:  a7a3 5a18 d396 5f04 5cb4 62af 89d7 0f8b
	0x0080:  003e 1302 1303 1301 c02c c030 009f cca9
	0x0090:  cca8 ccaa c02b c02f 009e c024 c028 006b
	0x00a0:  c023 c027 0067 c00a c014 0039 c009 c013
	0x00b0:  0033 009d 009c 003d 003c 0035 002f 00ff
	0x00c0:  0100 066d 0000 000f 000d 0000 0a77 6562
	0x00d0:  2e6d 6178 2e72 7500 0b00 0403 0001 0200
	0x00e0:  0a00 1600 1400 1d00 1700 1e00 1900 1801
	0x00f0:  0001

```

</details>

<details>
<summary>ciadpi-mips log</summary>

```
root@OpenWrt:~# ciadpi-mips -x2 -i 192.168.239.1 -T1.5 -f-1 -nweb.max.ru -t7
new event: fd: 3, type: 1
accept: fd=5
new event: fd: 5, type: 1
alloc new buffer
new event: fd: 5, type: 1
resolve: www.fontanka.ru
new conn: fd=6, pair=5, addr=195.19.220.21:443
new event: fd: 6, type: 4
new event: fd: 5, type: 1
desync TCP: group=0, round=1, fd=6
host: www.fontanka.ru (145)
split: pos=0-1724 (1724), m: DESYNC_FAKE
send: pos=1724-1725
new event: fd: 6, type: 1
new event: fd: 6, type: 1
close: fd=6 (pair=5), recv: 7, rounds: 1
close: fd=5 (pair=-1), recv: 1725, rounds: 1
new event: fd: 3, type: 1
accept: fd=5
new event: fd: 5, type: 1
new event: fd: 5, type: 1
resolve: www.fontanka.ru
new conn: fd=6, pair=5, addr=195.19.220.21:443
new event: fd: 6, type: 4
new event: fd: 5, type: 1
desync TCP: group=0, round=1, fd=6
host: www.fontanka.ru (145)
split: pos=0-1788 (1788), m: DESYNC_FAKE
send: pos=1788-1789
new event: fd: 6, type: 1
new event: fd: 6, type: 1
close: fd=6 (pair=5), recv: 7, rounds: 1
close: fd=5 (pair=-1), recv: 1789, rounds: 1
^Cnew event: fd: 3, type: 16
accept: Invalid argument
close: fd=3 (pair=-1), recv: 0, rounds: 0
exit
buffers count: 1
group: 0, triggered: 0, pri: 0
group: 1, triggered: 0, pri: 0
```

</details>

As you can see, fake packets are sent with TTL=7, as they should. But later, when `ack 1` is received from server, the same packets are retransmitted with TTL=64. This is incorrect. The original packets should be retransmitted instead. They should not contain a bunch of zeroes at the end. As a result, the server return a 7-byte packet and closes the connection. The browser show `ERR_SSL_PROTOCOL_ERROR`.

When I use ByeByeDPI app on the Android phone (which internally runs the ByeDPI v0.17.3) with the same parameters (except for the IP address: it is not needed there), `--fake` works as intended. The phone is connected to the Internet via the same router and the same modem.

```
tcpdump -i eth2 "host 195.19.220.21" -v -c20 -x -s256 > /tmp/dump-android.txt
```

<details>
<summary>/tmp/dump-android.txt</summary>

```
19:46:30.606930 IP (tos 0x0, ttl 63, id 57299, offset 0, flags [none], proto TCP (6), length 60)
    10.120.26.36.48183 > 195.19.220.21.443: Flags [S], cksum 0x6fa9 (correct), seq 277020887, win 65535, options [mss 1460,sackOK,TS val 47989352 ecr 0,nop,wscale 8], length 0
	0x0000:  4500 003c dfd3 0000 3f06 d823 0a78 1a24
	0x0010:  c313 dc15 bc37 01bb 1083 00d7 0000 0000
	0x0020:  a002 ffff 6fa9 0000 0204 05b4 0402 080a
	0x0030:  02dc 4268 0000 0000 0103 0308
19:46:30.644985 IP (tos 0x28, ttl 51, id 0, offset 0, flags [DF], proto TCP (6), length 60)
    195.19.220.21.443 > 10.120.26.36.48183: Flags [S.], cksum 0xa39f (correct), seq 716064458, ack 277020888, win 31856, options [mss 1360,sackOK,TS val 718058408 ecr 47989352,nop,wscale 7], length 0
	0x0000:  4528 003c 0000 4000 3306 83cf c313 dc15
	0x0010:  0a78 1a24 01bb bc37 2aae 46ca 1083 00d8
	0x0020:  a012 7c70 a39f 0000 0204 0550 0402 080a
	0x0030:  2acc b3a8 02dc 4268 0103 0307
19:46:30.648344 IP (tos 0x0, ttl 63, id 57302, offset 0, flags [none], proto TCP (6), length 52)
    10.120.26.36.48183 > 195.19.220.21.443: Flags [.], cksum 0x4d1d (correct), ack 1, win 343, options [nop,nop,TS val 47989356 ecr 718058408], length 0
	0x0000:  4500 0034 dfd6 0000 3f06 d828 0a78 1a24
	0x0010:  c313 dc15 bc37 01bb 1083 00d8 2aae 46cb
	0x0020:  8010 0157 4d1d 0000 0101 080a 02dc 426c
	0x0030:  2acc b3a8
19:46:30.649767 IP (tos 0x0, ttl 6, id 57303, offset 0, flags [none], proto TCP (6), length 1076)
    10.120.26.36.48183 > 195.19.220.21.443: Flags [P.], seq 1:1025, ack 1, win 343, options [nop,nop,TS val 47989356 ecr 718058408], length 1024
	0x0000:  4500 0434 dfd7 0000 0606 0d28 0a78 1a24
	0x0010:  c313 dc15 bc37 01bb 1083 00d8 2aae 46cb
	0x0020:  8018 0157 4c82 0000 0101 080a 02dc 426c
	0x0030:  2acc b3a8 1603 0106 f801 0006 f403 0303
	0x0040:  5f6f 2ced 1322 f8dc b2f2 6048 2d72 666f
	0x0050:  57dd 139d 1b37 dcfa 362e baf9 9299 3a20
	0x0060:  f9df 0c2e 8a55 8982 3163 1aef a8be 0858
	0x0070:  a7a3 5a18 d396 5f04 5cb4 62af 89d7 0f8b
	0x0080:  003e 1302 1303 1301 c02c c030 009f cca9
	0x0090:  cca8 ccaa c02b c02f 009e c024 c028 006b
	0x00a0:  c023 c027 0067 c00a c014 0039 c009 c013
	0x00b0:  0033 009d 009c 003d 003c 0035 002f 00ff
	0x00c0:  0100 066d 0000 000f 000d 0000 0a77 6562
	0x00d0:  2e6d 6178 2e72 7500 0b00 0403 0001 0200
	0x00e0:  0a00 1600 1400 1d00 1700 1e00 1900 1801
	0x00f0:  0001
19:46:30.649918 IP (tos 0x0, ttl 6, id 57304, offset 0, flags [none], proto TCP (6), length 816)
    10.120.26.36.48183 > 195.19.220.21.443: Flags [P.], seq 1025:1789, ack 1, win 343, options [nop,nop,TS val 47989356 ecr 718058408], length 764
	0x0000:  4500 0330 dfd8 0000 0606 0e2b 0a78 1a24
	0x0010:  c313 dc15 bc37 01bb 1083 04d8 2aae 46cb
	0x0020:  8018 0157 4619 0000 0101 080a 02dc 426c
	0x0030:  2acc b3a8 0000 0000 0000 0000 0000 0000
	0x0040:  0000 0000 0000 0000 0000 0000 0000 0000
	0x0050:  0000 0000 0000 0000 0000 0000 0000 0000
	0x0060:  0000 0000 0000 0000 0000 0000 0000 0000
	0x0070:  0000 0000 0000 0000 0000 0000 0000 0000
	0x0080:  0000 0000 0000 0000 0000 0000 0000 0000
	0x0090:  0000 0000 0000 0000 0000 0000 0000 0000
	0x00a0:  0000 0000 0000 0000 0000 0000 0000 0000
	0x00b0:  0000 0000 0000 0000 0000 0000 0000 0000
	0x00c0:  0000 0000 0000 0000 0000 0000 0000 0000
	0x00d0:  0000 0000 0000 0000 0000 0000 0000 0000
	0x00e0:  0000 0000 0000 0000 0000 0000 0000 0000
	0x00f0:  0000
19:46:30.650041 IP (tos 0x0, ttl 63, id 57305, offset 0, flags [none], proto TCP (6), length 53)
    10.120.26.36.48183 > 195.19.220.21.443: Flags [P.], cksum 0x4618 (correct), seq 1789:1790, ack 1, win 343, options [nop,nop,TS val 47989356 ecr 718058408], length 1
	0x0000:  4500 0035 dfd9 0000 3f06 d824 0a78 1a24
	0x0010:  c313 dc15 bc37 01bb 1083 07d4 2aae 46cb
	0x0020:  8018 0157 4618 0000 0101 080a 02dc 426c
	0x0030:  2acc b3a8 00
19:46:30.695016 IP (tos 0x28, ttl 51, id 39161, offset 0, flags [DF], proto TCP (6), length 64)
    195.19.220.21.443 > 10.120.26.36.48183: Flags [.], cksum 0xe681 (correct), ack 1, win 249, options [nop,nop,TS val 718058459 ecr 47989356,nop,nop,sack 1 {1789:1790}], length 0
	0x0000:  4528 0040 98f9 4000 3306 ead1 c313 dc15
	0x0010:  0a78 1a24 01bb bc37 2aae 46cb 1083 00d8
	0x0020:  b010 00f9 e681 0000 0101 080a 2acc b3db
	0x0030:  02dc 426c 0101 050a 1083 07d4 1083 07d5
19:46:30.714939 IP (tos 0x0, ttl 63, id 57307, offset 0, flags [none], proto TCP (6), length 1076)
    10.120.26.36.48183 > 195.19.220.21.443: Flags [.], seq 1:1025, ack 1, win 343, options [nop,nop,TS val 47989363 ecr 718058459], length 1024
	0x0000:  4500 0434 dfdb 0000 3f06 d423 0a78 1a24
	0x0010:  c313 dc15 bc37 01bb 1083 00d8 2aae 46cb
	0x0020:  8010 0157 ed74 0000 0101 080a 02dc 4273
	0x0030:  2acc b3db 1603 0106 f801 0006 f403 0338
	0x0040:  8206 7ccd 451a 8f8e 0e63 9c7c 5d3a 56b3
	0x0050:  f29d 4466 9948 1c8d 203e b68a 9ad0 e220
	0x0060:  0341 5bd4 e274 c541 6bfa 5ed6 db51 29cc
	0x0070:  f6a3 1b43 e929 b542 87ae 2816 b1e0 cc3f
	0x0080:  0020 baba 1301 1302 1303 c02b c02f c02c
	0x0090:  c030 cca9 cca8 c013 c014 009c 009d 002f
	0x00a0:  0035 0100 068b 0a0a 0000 0005 0005 0100
	0x00b0:  0000 0000 0b00 0201 00ff 0100 0100 000d
	0x00c0:  0012 0010 0403 0804 0401 0503 0805 0501
	0x00d0:  0806 0601 0012 0000 0010 000e 000c 0268
	0x00e0:  3208 6874 7470 2f31 2e31 0017 0000 0023
	0x00f0:  0000
19:46:30.715119 IP (tos 0x0, ttl 63, id 57308, offset 0, flags [none], proto TCP (6), length 816)
    10.120.26.36.48183 > 195.19.220.21.443: Flags [P.], seq 1025:1789, ack 1, win 343, options [nop,nop,TS val 47989363 ecr 718058459], length 764
	0x0000:  4500 0330 dfdc 0000 3f06 d526 0a78 1a24
	0x0010:  c313 dc15 bc37 01bb 1083 04d8 2aae 46cb
	0x0020:  8018 0157 0f92 0000 0101 080a 02dc 4273
	0x0030:  2acc b3db bd19 70f4 7231 7662 aff9 18cf
	0x0040:  e9e8 327a 7414 3f84 4a72 c91a 46cb 7354
	0x0050:  d6b1 cce2 cbcb a9cd c1a0 c8ea 44a6 8f04
	0x0060:  a94f d449 12a1 33fa 9793 4ca0 83c8 7296
	0x0070:  0ffc 4049 030c 26fa 8afe d759 2b12 a949
	0x0080:  673a 3ee9 3fef 5084 64ca c327 986c 7dea
	0x0090:  53e4 e81f bcb7 ae90 8934 383b 5a96 e67a
	0x00a0:  2603 8cf0 8b76 7ff4 698a f56d 9310 ab64
	0x00b0:  6641 4872 198d 0a71 68bb 91a4 826f 6956
	0x00c0:  3bef e7b8 2b4b 2253 82b4 afc8 a130 7c66
	0x00d0:  80f1 03dc 27ca ef0a 3969 5166 3925 20ad
	0x00e0:  f52d 25eb 0c1e 7513 068c 3586 7901 40f0
	0x00f0:  4772
19:46:30.756031 IP (tos 0x28, ttl 51, id 39162, offset 0, flags [DF], proto TCP (6), length 64)
    195.19.220.21.443 > 10.120.26.36.48183: Flags [.], cksum 0xe23d (correct), ack 1025, win 249, options [nop,nop,TS val 718058520 ecr 47989363,nop,nop,sack 1 {1789:1790}], length 0
	0x0000:  4528 0040 98fa 4000 3306 ead0 c313 dc15
	0x0010:  0a78 1a24 01bb bc37 2aae 46cb 1083 04d8
	0x0020:  b010 00f9 e23d 0000 0101 080a 2acc b418
	0x0030:  02dc 4273 0101 050a 1083 07d4 1083 07d5
19:46:30.764064 IP (tos 0x28, ttl 51, id 39163, offset 0, flags [DF], proto TCP (6), length 52)
    195.19.220.21.443 > 10.120.26.36.48183: Flags [.], cksum 0x4604 (correct), ack 1790, win 249, options [nop,nop,TS val 718058523 ecr 47989363], length 0
	0x0000:  4528 0034 98fb 4000 3306 eadb c313 dc15
	0x0010:  0a78 1a24 01bb bc37 2aae 46cb 1083 07d5
	0x0020:  8010 00f9 4604 0000 0101 080a 2acc b41b
	0x0030:  02dc 4273
19:46:30.764339 IP (tos 0x28, ttl 51, id 39164, offset 0, flags [DF], proto TCP (6), length 1400)
    195.19.220.21.443 > 10.120.26.36.48183: Flags [.], seq 1:1349, ack 1790, win 249, options [nop,nop,TS val 718058523 ecr 47989363], length 1348
	0x0000:  4528 0578 98fc 4000 3306 e596 c313 dc15
	0x0010:  0a78 1a24 01bb bc37 2aae 46cb 1083 07d5
	0x0020:  8010 00f9 af6e 0000 0101 080a 2acc b41b
	0x0030:  02dc 4273 1603 0300 7a02 0000 7603 031f
	0x0040:  1d05 9810 661c d090 ce67 f708 e0f1 b9a3
	0x0050:  1b5d 6c28 a4d4 affd f6e9 e960 36ff be20
	0x0060:  0341 5bd4 e274 c541 6bfa 5ed6 db51 29cc
	0x0070:  f6a3 1b43 e929 b542 87ae 2816 b1e0 cc3f
	0x0080:  1301 0000 2e00 2b00 0203 0400 3300 2400
	0x0090:  1d00 205c 6908 da43 1773 d437 9db9 caf0
	0x00a0:  7855 de71 ce2e f419 0bc2 5f44 ed60 643b
	0x00b0:  6615 1a14 0303 0001 0117 0303 0024 c439
	0x00c0:  932f 41bb 0c6c 545e 6466 2dc1 4e0d da3f
	0x00d0:  40c0 5c58 d443 6e97 a729 9f1b 00f6 0e70
	0x00e0:  aa5d 1703 030a 35df 7208 183e 660e c818
	0x00f0:  6e97
19:46:30.764491 IP (tos 0x28, ttl 51, id 39165, offset 0, flags [DF], proto TCP (6), length 1400)
    195.19.220.21.443 > 10.120.26.36.48183: Flags [P.], seq 1349:2697, ack 1790, win 249, options [nop,nop,TS val 718058523 ecr 47989363], length 1348
	0x0000:  4528 0578 98fd 4000 3306 e595 c313 dc15
	0x0010:  0a78 1a24 01bb bc37 2aae 4c0f 1083 07d5
	0x0020:  8018 00f9 5c16 0000 0101 080a 2acc b41b
	0x0030:  02dc 4273 0cd6 08bd e92c 69e3 9858 12cd
	0x0040:  7a99 a2a1 bdac ad2f 6a9c 4ac2 4408 1d94
	0x0050:  0a13 bbd2 5da6 fe09 3cf5 8f46 a426 3bcc
	0x0060:  6410 ae18 e642 c257 95c5 06af 0f8f 415b
	0x0070:  f6c3 c725 3bd5 6b0b 7cbc 1825 deec 91fe
	0x0080:  fb81 0490 47d7 2e41 0b2b 5593 d15f c531
	0x0090:  954e a66b 8d06 d758 898d bfb9 9fab 974c
	0x00a0:  ca32 ebfe 4edb 3f3f f220 d0f0 b883 d552
	0x00b0:  069e e4a2 7c33 f90b ceed 1b09 560f c8e8
	0x00c0:  518b 2109 d3c2 1444 77e5 db9a 0822 1042
	0x00d0:  fc8c b1d3 fc90 156f 15e4 5463 6bd5 6d7d
	0x00e0:  7905 2c00 ec36 8f55 1539 a624 49af 9aa8
	0x00f0:  f4fc
19:46:30.764601 IP (tos 0x28, ttl 51, id 39166, offset 0, flags [DF], proto TCP (6), length 492)
    195.19.220.21.443 > 10.120.26.36.48183: Flags [P.], seq 2697:3137, ack 1790, win 249, options [nop,nop,TS val 718058523 ecr 47989363], length 440
	0x0000:  4528 01ec 98fe 4000 3306 e920 c313 dc15
	0x0010:  0a78 1a24 01bb bc37 2aae 5153 1083 07d5
	0x0020:  8018 00f9 b476 0000 0101 080a 2acc b41b
	0x0030:  02dc 4273 d463 d5a6 3f3b bed8 5fa2 b92e
	0x0040:  51d1 162e ba8b 1999 6d4b 2e11 f9e7 8a0d
	0x0050:  436c 0477 4ed1 3d09 9a2b db32 3ace 25cc
	0x0060:  6f4d e1ea 97fe 13ee b5d4 3657 55b5 1d62
	0x0070:  a868 b591 9aff 9abb 5a93 ecde dab7 ed64
	0x0080:  540f 7cab b1d1 f70d 58a4 bacf cdf2 909c
	0x0090:  9bf2 71cc 1703 0301 19c8 44f1 6888 c120
	0x00a0:  8671 730a 06aa 892f f1cf 1fb6 ca2b 58e7
	0x00b0:  5e8e 5297 5ccf a3ac 5855 d4b6 faa7 114d
	0x00c0:  9a0c b42b 237e 53ba 56a4 3f3d c360 a647
	0x00d0:  7013 3b35 5e89 10c6 7583 3c0c 6cd6 82a7
	0x00e0:  2ded 900d 9856 7a5e bb9f d424 5e2b 46c7
	0x00f0:  80b8
19:46:30.765876 IP (tos 0x0, ttl 63, id 57312, offset 0, flags [none], proto TCP (6), length 52)
    10.120.26.36.48183 > 195.19.220.21.443: Flags [.], cksum 0x4053 (correct), ack 1349, win 353, options [nop,nop,TS val 47989368 ecr 718058523], length 0
	0x0000:  4500 0034 dfe0 0000 3f06 d81e 0a78 1a24
	0x0010:  c313 dc15 bc37 01bb 1083 07d5 2aae 4c0f
	0x0020:  8010 0161 4053 0000 0101 080a 02dc 4278
	0x0030:  2acc b41b
19:46:30.766046 IP (tos 0x0, ttl 63, id 57313, offset 0, flags [none], proto TCP (6), length 52)
    10.120.26.36.48183 > 195.19.220.21.443: Flags [.], cksum 0x3b04 (correct), ack 2697, win 364, options [nop,nop,TS val 47989368 ecr 718058523], length 0
	0x0000:  4500 0034 dfe1 0000 3f06 d81d 0a78 1a24
	0x0010:  c313 dc15 bc37 01bb 1083 07d5 2aae 5153
	0x0020:  8010 016c 3b04 0000 0101 080a 02dc 4278
	0x0030:  2acc b41b
19:46:30.766518 IP (tos 0x0, ttl 63, id 57314, offset 0, flags [none], proto TCP (6), length 52)
    10.120.26.36.48183 > 195.19.220.21.443: Flags [.], cksum 0x3942 (correct), ack 3137, win 374, options [nop,nop,TS val 47989368 ecr 718058523], length 0
	0x0000:  4500 0034 dfe2 0000 3f06 d81c 0a78 1a24
	0x0010:  c313 dc15 bc37 01bb 1083 07d5 2aae 530b
	0x0020:  8010 0176 3942 0000 0101 080a 02dc 4278
	0x0030:  2acc b41b
19:46:30.825249 IP (tos 0x0, ttl 63, id 57319, offset 0, flags [none], proto TCP (6), length 116)
    10.120.26.36.48183 > 195.19.220.21.443: Flags [P.], cksum 0x1d13 (correct), seq 1790:1854, ack 3137, win 374, options [nop,nop,TS val 47989374 ecr 718058523], length 64
	0x0000:  4500 0074 dfe7 0000 3f06 d7d7 0a78 1a24
	0x0010:  c313 dc15 bc37 01bb 1083 07d5 2aae 530b
	0x0020:  8018 0176 1d13 0000 0101 080a 02dc 427e
	0x0030:  2acc b41b 1403 0300 0101 1703 0300 35b7
	0x0040:  487f df6f 1c5e 4efe 7ab8 81aa 541d 0855
	0x0050:  e65b eb32 7cd0 41ea 22dd 39d8 0145 353a
	0x0060:  66be 03d7 6f76 45df e9f9 e94f a9cf 7be8
	0x0070:  696a 222c
19:46:30.831547 IP (tos 0x0, ttl 63, id 57320, offset 0, flags [none], proto TCP (6), length 144)
    10.120.26.36.48183 > 195.19.220.21.443: Flags [P.], cksum 0xba00 (correct), seq 1854:1946, ack 3137, win 374, options [nop,nop,TS val 47989374 ecr 718058523], length 92
	0x0000:  4500 0090 dfe8 0000 3f06 d7ba 0a78 1a24
	0x0010:  c313 dc15 bc37 01bb 1083 0815 2aae 530b
	0x0020:  8018 0176 ba00 0000 0101 080a 02dc 427e
	0x0030:  2acc b41b 1703 0300 5736 ea62 88a7 d9c7
	0x0040:  0f65 29a4 2705 150e 526e ad77 aa43 b81c
	0x0050:  3dfd bc0d 452a ef3e 8f76 6181 f0b1 380a
	0x0060:  b001 ba7f 37a9 c55f 71da 6899 e86c becf
	0x0070:  57e6 981f 3ce4 60d2 ee7d 6c40 86e4 437f
	0x0080:  c8f4 5e2b 13a5 0b3c 9f7b a0b9 4e53 305d
19:46:30.846890 IP (tos 0x0, ttl 63, id 57321, offset 0, flags [none], proto TCP (6), length 522)
    10.120.26.36.48183 > 195.19.220.21.443: Flags [P.], seq 1946:2416, ack 3137, win 374, options [nop,nop,TS val 47989376 ecr 718058523], length 470
	0x0000:  4500 020a dfe9 0000 3f06 d63f 0a78 1a24
	0x0010:  c313 dc15 bc37 01bb 1083 0871 2aae 530b
	0x0020:  8018 0176 18ba 0000 0101 080a 02dc 4280
	0x0030:  2acc b41b 1703 0301 d1b9 5ea6 a8ff 2346
	0x0040:  eb84 7b4d de87 857a fbc4 f246 9ed5 64c0
	0x0050:  0ba9 ba74 8d80 7d1c 1649 ea06 094e aa97
	0x0060:  9728 8900 aa9b b1a6 b6b5 c70d e3ff bf6b
	0x0070:  1be9 8a81 fe63 2293 ae0b 7cbd abb1 1a26
	0x0080:  5ae3 8303 de9e 1a0b 0950 4aac f91c 7f7c
	0x0090:  ad00 9f4a fc40 dd82 3fba 3320 e246 a9bd
	0x00a0:  cdc0 d2e7 0316 6b28 9e57 f000 6244 97e1
	0x00b0:  2ce8 19fd a6e2 11bc b706 6f52 4c6d 95a4
	0x00c0:  6516 8dfe 10a5 94ac bbf3 b033 4fa5 748a
	0x00d0:  ce04 2ae8 4cd5 0f69 60dc a464 ebff 4f4e
	0x00e0:  433d 8e8b 901b 4bc7 c856 e1a7 6c96 818a
	0x00f0:  6f02

```

</details>

Here the retransmitted packets differ from the fake ones. The server doesn't close the connection. And, of course, all TTL values are reduced by 1. The website loads without any errors. And if I replace `-t7` with `-t64`, the same SSL error appears (which is correct, because in this case the fake packets reach the server).

# Hardware and software configuration

* Router: TL-WR741ND with hardware mods (16MB flash, 64MB RAM, USB 1.1)
* SoC: Atheros AR7240 (mips_24kc architecture)
* OS: Custom OpenWRT build for the `ath79` subtarget, based on [v19.07.10](https://github.com/openwrt/openwrt/tree/v19.07.10) (modified flash layout, added USB support, fixed reset bug in the ar72xx USB PHY driver)

```
BusyBox v1.30.1 () built-in shell (ash)

  _______                     ________        __
 |       |.-----.-----.-----.|  |  |  |.----.|  |_
 |   -   ||  _  |  -__|     ||  |  |  ||   _||   _|
 |_______||   __|_____|__|__||________||__|  |____|
          |__| W I R E L E S S   F R E E D O M
 -----------------------------------------------------
 OpenWrt 19.07.10, r11427-9ce6aa9d8d
 -----------------------------------------------------
root@OpenWrt:~# uname -r
4.14.275
```

* Modem: Fibocom L-860GL in NCM mode (`cdc_ncm` and `cdc_acm` kernel modules)
* Android phone OS: Android 9

# My thoughts

As I can tell after investigating the source code, `--fake` is implemented using `mmap()`, `vmsplice()` and `splice()`. According to the [documentation](https://man7.org/linux/man-pages/man2/vmsplice.2.html), the memory pages gifted to the kernel with `SPLICE_F_GIFT` should not be modified. But they are modified by the code, and, this is exactly what allows us to get the correct data in the retransmitted packets (correct me if I'm wrong). And for some reason this hack doesn't work in this particular case.

First I thought the router's CPU is too slow (only 400 MHz, single core) to overwrite the data in time. But this is not true. I added some code to measure the time, and it takes not more that 2 ms from `send_fake()` to `restore_state()`. `ack 1` comes from the server in 42 ms after sending the fake packets, as it can be observed in the dump. There should be plenty of time there.

Then I tried to replace `mmap()`/`vmsplice()`/`splice()` with `open("/tmp/", O_TMPFILE | O_RDWR)` and `sendfile()`, inspired by `send_fake()` implementation for Windows. This approach works fine on a Debian 12 VM I use to build OpenWrt (I can even access blocked websites), but it fails in exactly the same way on the router.

I also tried to add delays in various places, `fsync()` and `msync()` calls, etc., but none of that helped.

It looks like the fake data is cached somewhere in the kernel memory instead of being sent in a "zero-copy" manner. Or maybe the modem handles the retransmission, not the kernel (but why can we see retransmissions in the output of `tcpdump` then?). USB NCM protocol  [specification](https://www.usb.org/sites/default/files/NCM11.pdf) mentions TCP fragmentation, but I haven't looked into that yet.

Maybe the problem can be solved by building the kernel with some specific configuration, or configuring the TCP/IP stack with `sysctl -w net.*`. I'm not familiar with these things, unfortunately.

Any help is appreciated. I really don't want to use `zapret/nfqws` because it lacks some features like automatic modes, and probably is quite resource-hungry for a router with a slow CPU and 64 MB RAM (although, I haven't tested it, maybe I should).
